{
  "sessionId": "ses_2026_06_28_001",
  "projectId": "doughboy-vinyl-technologies",
  "objectiveId": "obj_checkout_004",
  "status": "completed",
  "summary": "Implemented the responsive checkout layout and form structure.",
  "changedFiles": [
    "src/checkout/CheckoutPage.tsx",
    "src/checkout/checkout.css"
  ],
  "validation": [
    {
      "command": "npm run lint",
      "status": "passed"
    },
    {
      "command": "npm test",
      "status": "passed"
    }
  ],
  "decisions": [
    {
      "decision": "Retained the existing checkout state manager.",
      "reason": "Replacing it was outside the active slice."
    }
  ],
  "blockers": [],
  "nextRecommendedAction": "Connect the layout to the payment provider test environment."
}
